{
  "schema_version": 1,
  "feedback_id": "22222222-2222-4222-8222-222222222222",
  "run_id": "11111111-1111-4111-8111-111111111111",
  "origin": "synthetic_fixture",
  "recommendation_id": "recommendation-fixed",
  "recommendation_hash": "3cd920915090e29d2d6aec5ce1897f8357d0e0795f1a4c548ac5aeb7b3184db9",
  "reviewer": "local-reviewer",
  "assessment": "uncertain",
  "comment": "Учебная оценка: требуется проверка причины.",
  "supersedes_id": null,
  "created_at": "2026-10-15T12:00:00Z"
}
